temporada,programa,cancion,artista,j1,j2,j3,j4,publico,bonus,final,total,j5
3,13,"Irressistible/Ouragan, de Estefanía de Mónaco",Llum Barrera,7,7.0,9,10,0,Santi,0.0,38,0
3,13,"Nada cambiará mi amor por ti, de Glenn Medeiros",Xuso Jones,9,10.0,10,9,0,Melody,0.0,38,0
3,13,"Dolce vita, de Ryan Paris",José Manuel Soto,5,8.0,7,6,0,Melody,0.0,36,0
3,13,"Born to be alive, de Patrick Hernández",Florentino Fernández,8,6.0,11,7,0,Edurne,0.0,32,0
3,13,"Hasiendo el amor, de Dinio",Santi Rodríguez,10,5.0,6,4,0,Llum,0.0,30,0
3,13,"No rompas más (Mi pobre corazón), de Coyote Dax",Ángela Carrasco,6,9.0,4,11,0,Los Chunguitos,0.0,30,0
3,13,"Vamos a la playa, de Righeira",Los Chunguitos,4,4.0,5,5,0,José Manuel,0.0,23,0
3,14,"The boy does nothing, de Alesha Dixon",Melody,11,10.0,10,11,0,Llum,0.0,57,0
3,14,"Crazy in love, de Beyoncé",Edurne,12,12.0,12,12,0,Santi,0.0,53,0
3,14,"Hey ya!, de André 3000 (Outkast)",Xuso Jones,10,11.0,11,9,0,Florentino,0.0,46,0
3,14,"Rufino, de Luz Casal",Llum Barrera,8,6.0,9,10,0,Melody,0.0,38,0
3,14,"Historia de un amor, de Eydie Gormé con Café Quijano como Los Panchos",Ángela Carrasco,7,9.0,8,6,0,Melody,0.0,35,0
3,14,"Don't leave me this way, de Jimmy Sommerville",Florentino Fernández,9,8.0,5,8,0,Ángela,0.0,35,0
3,14,"La Lola, de Manuel Quijano (Café Quijano)",Santi Rodríguez,4,7.0,7,5,0,Xuso,0.0,28,0
3,14,"Romeo y Julieta, de Karina",José Manuel Soto,5,4.0,6,7,0,Melody,0.0,22,0
3,14,"Amigos para siempre, de Los Manolos",Los Chunguitos,6,5.0,4,4,0,Edurne,0.0,19,0
3,15,"Cuban Pete, de Jim Carrey (La Máscara)",Florentino Fernández,9,9.0,8,7,0,Llum,0.0,58,0
3,15,"Like a prayer, de Madonna",Llum Barrera,11,10.0,11,11,0,Florentino,0.0,48,0
3,15,"Hijo de la luna, de Ana Torroja (Mecano)",Melody,12,11.0,6,6,0,Edurne,0.0,40,0
3,15,"Y ahora, de Manuel Carrasco",José Manuel Soto,7,6.0,9,10,0,Florentino,0.0,37,0
3,15,"Bleeding Love, de Leona Lewis",Edurne,10,12.0,4,5,0,Florentino,0.0,36,0
3,15,"Ayer, de Gloria Estefan",Ángela Carrasco,5,8.0,12,8,0,Florentino,0.0,33,0
3,15,"Cuanto más acelero, de Javi Cantero",Santi Rodríguez,6,5.0,10,9,0,Florentino,0.0,30,0
3,15,"Torero, de Julio Iglesias y José Luis Rodríguez ""El Puma""",Los Chunguitos,4,4.0,7,12,0,Melody,0.0,27,0
3,15,"No puedo vivir sin ti, de Coque Malla (Los Ronaldos)",Xuso Jones,8,7.0,5,4,0,José Manuel,0.0,24,0
3,16,"Do What U Want, de Lady Gaga con Angy como Christina Aguilera",Melody,12,12.0,12,12,0,Florentino,0.0,63,0
3,16,"Vivo por ella, de Marta Sánchez con Daniel Diges como Andrea Bocelli",Edurne,10,11.0,11,9,0,Ángela,0.0,46,0
3,16,"You're my heart, you're my soul y Brother Louie, de Thomas Anders con Edu Soto como Dieter Bohlen (Modern Talking)",Xuso Jones,11,9.0,8,11,0,Llum,0.0,44,0
3,16,"All the things she said, de Julia Volkova con Carolina Ferre como Lena Katina (t.A.T.u)",Llum Barrera,9,10.0,9,8,0,Los Chunguitos,0.0,41,0
3,16,"La yenka y Super disco chino, de Enrique del Pozo con Anna Simon como Ana Anguita (Enrique y Ana)",Florentino Fernández,8,4.0,10,7,0,Melody,0.0,34,0
3,16,"Corazón contento, de Marisol con Roberto Leal como Palito Ortega",Ángela Carrasco,6,7.0,5,10,0,Edurne,0.0,33,0
3,16,"Eso es el amor, de María Durán, Mayra Gómez Kemp con Toñi Salazar como Beatriz Escudero (Trío Acuario)",Los Chunguitos,7,5.0,4,5,0,Melody,0.0,26,0
3,16,"Dos hombres y un destino, de David Bustamante con Francisco como Alex Casademunt",José Manuel Soto,5,8.0,6,6,0,Xuso,0.0,25,0
3,16,"La lista de la compra, de Lichis (La Cabra Mecánica) con Loles León como María Jiménez",Santi Rodríguez,4,6.0,7,4,0,Melody,0.0,21,0
3,17,"In the Ghetto, de El Príncipe Gitano",Santi Rodríguez,9,10.0,12,12,0,Los Chunguitos,0.0,58,0
3,17,"Torre de arena, de Marifé de Triana",Edurne,12,12.0,11,11,0,Melody,0.0,56,0
3,17,"Puedes contar conmigo, de Amaia Montero (La Oreja de Van Gogh)",Melody,11,11.0,10,9,0,Edurne,0.0,46,0
3,17,"Tu nombre me sabe a yerba, de Joan Manuel Serrat",José Manuel Soto,10,9.0,9,10,0,Santi,0.0,38,0
3,17,"No estamos lokos, de Ketama",Los Chunguitos,8,5.0,5,7,0,Ángela,0.0,35,0
3,17,"Talk dirty, de Jason Derülo",Xuso Jones,7,8.0,8,8,0,Santi,0.0,31,0
3,17,"Fuck You!, de Cee Lo Green",Florentino Fernández,6,7.0,7,6,0,Edurne,0.0,26,0
3,17,"Flashdance... What a Feeling, de Irene Cara",Llum Barrera,5,6.0,6,5,0,Santi,0.0,22,0
3,17,"Luna de miel, de Paloma San Basilio",Ángela Carrasco,4,4.0,4,4,0,Los Chunguitos,0.0,21,0
3,18,"Señora, de Rocío Jurado",Melody,12,12.0,10,12,0,Los Chunguitos,0.0,56,0
3,18,"With a little help from my friends, de Joe Cocker con Las Supremas de Móstoles como coristas",Florentino Fernández,11,11.0,12,11,0,Melody,0.0,50,0
3,18,"Como el agua, de Camarón de la Isla y Paco de Lucía",Los Chunguitos,8,8.0,9,8,0,Melody,0.0,48,0
3,18,"I Don't Want to Miss a Thing, de Steven Tyler (Aerosmith)",Xuso Jones,9,10.0,11,10,0,Florentino,0.0,40,0
3,18,"Hopelessly devoted to you, de Olivia Newton-John (Grease)",Llum Barrera,7,7.0,7,9,0,José Manuel,0.0,35,0
3,18,"Mucho mejor, de Andrés Calamaro (Los Rodríguez)",Santi Rodríguez,10,9.0,6,7,0,Llum,0.0,32,0
3,18,"La minifalda y Mujeres y vino, de Manolo Escobar",José Manuel Soto,6,6.0,8,5,0,Los Chunguitos,0.0,30,0
3,18,"Me voy, de Julieta Venegas",Ángela Carrasco,5,5.0,5,6,0,Los Chunguitos,0.0,21,0
4,1,"The Edge of Glory, de Lady Gaga",Ruth Lorenzo,11,11.0,12,10,12,Pablo,24.0,44 (12),0
4,1,"Sugar, de Adam Levine (Maroon 5)",Pablo Puyol,12,10.0,10,9,10,Edu,21.0,44 (11),0
4,1,"Al son del tambor, de Rosario Flores",Edu Soto,10,5.0,6,11,11,Falete,19.0,35 (8),0
4,1,"¡Qué dolor!, de Raffaella Carrà",Silvia Abril,9,6.0,11,12,8,El Sevilla,18.0,41 (10),0
4,1,"Where Are Ü Now, de Justin Bieber",Adrián Rodríguez,7,12.0,8,7,9,El Sevilla,16.0,34 (7),0
4,1,"Te amo, de Umberto Tozzi",Falete,8,9.0,9,8,7,Ana,16.0,37 (9),0
4,1,"Sólo le pido a Dios, de Ana Belén",Vicky Larraz,6,8.0,7,6,6,Silvia,11.0,27 (5),0
4,1,"Walking on Sunshine, de Katrina Leskanich (Katrina & The Waves)",Ana Morgade,5,7.0,5,5,5,El Sevilla,11.0,28 (6),0
4,1,"Venezia, de David Summers (Hombres G)",El Sevilla,4,4.0,4,4,4,Ana,8.0,25 (4),0
4,2,"Algo de mí, de Camilo Sesto",Edu Soto,10,12.0,8,11,12,Pablo,24.0,44 (12),0
4,2,"Barcelona, de Freddie Mercury y Montserrat Caballé (Dos en uno)[18]​",Ruth Lorenzo,9,9.0,11,9,11,Pablo,22.0,44 (11),0
4,2,"I'm Outta Love, de Anastacia",Pablo Puyol,8,10.0,6,10,10,Ruth,19.0,40 (9),0
4,2,"Amor eterno, de Juan Gabriel",Falete,12,11.0,12,8,9,El Sevilla,19.0,43 (10),0
4,2,"Ángel malherido, de El Barrio",Adrián Rodríguez,11,8.0,7,12,8,Edu,16.0,38 (8),0
4,2,"Dark Horse, de Katy Perry",Vicky Larraz,7,7.0,10,6,6,Ana,12.0,30 (6),0
4,2,"Pégate, de Ylenia",Silvia Abril,4,4.0,4,5,7,El Sevilla,11.0,20 (4),0
4,2,"La isla bonita, de Madonna",Ana Morgade,6,6.0,9,7,4,Ruth,11.0,31 (7),0
4,2,"Quiero ser como tú, de El Rey Mono (El Libro de la Selva)",El Sevilla,5,5.0,5,4,5,Silvia,10.0,25 (5),0
4,3,"Con dos camas vacías, de María Jiménez (Reto)[19]​",Falete,12,12.0,12,12,12,Ruth,24.0,51 (12),0
4,3,"El perdón, de Nicky Jam",Adrián Rodríguez,11,11.0,10,10,11,Pablo,22.0,42 (11),0
4,3,"Entre dos tierras, de Enrique Bunbury (Héroes del Silencio)",Pablo Puyol,10,10.0,7,9,10,Silvia,20.0,39 (10),0
4,3,"Porque te vas, de Jeanette",El Sevilla,5,7.0,11,11,9,Ana,17.0,34 (8),0
4,3,"Losing My Religion, de Michael Stipe (R.E.M.)",Edu Soto,7,6.0,6,7,8,Ana,13.0,29 (5),0
4,3,"All Around the World, de Lisa Stansfield",Vicky Larraz,9,9.0,5,8,6,Ruth,13.0,34 (7),0
4,3,"Shake It Off, de Taylor Swift",Ana Morgade,6,8.0,9,6,4,Vicky,13.0,35 (9),0
4,3,"No One, de Sor Cristina",Silvia Abril,4,5.0,4,4,7,Edu,11.0,20 (4),0
4,3,"Se me olvidó otra vez, de María Jiménez",Ruth Lorenzo,8,4.0,8,5,5,Falete,11.0,31 (6),0
4,4,"Part-Time Lover, de Stevie Wonder",Pablo Puyol,11,12.0,10,11,12,Vicky,23.0,44 (11),0
4,4,"Nothing Compares 2 U, de Sinéad O'Connor",Ruth Lorenzo,12,10.0,11,10,11,Vicky,21.0,43 (10),0
4,4,"Mi nuevo vicio, de Paulina Rubio",Adrián Rodríguez,4,8.0,12,7,10,Vicky,19.0,34 (9),0
4,4,"Thinking Out Loud, de Ed Sheeran",Vicky Larraz,10,11.0,7,12,5,Adrián,17.0,55 (12),0
4,4,"Y nos dieron las diez, de Joaquín Sabina",El Sevilla,7,5.0,8,6,9,Vicky,15.0,29 (6),0
4,4,"Disparé, de Mai Meneses (Nena Daconte)",Ana Morgade,9,9.0,4,9,7,Silvia,15.0,31 (8),0
4,4,"Don Diablo, de Miguel Bosé",Silvia Abril,6,7.0,5,8,8,Edu,13.0,29 (5),0
4,4,"Mammy blue, de José Mercé",Edu Soto,8,6.0,9,5,6,El Sevilla,13.0,31 (7),0
4,4,"Historias de amor, de Jordi Sánchez (OBK)",Falete,5,4.0,6,4,4,Vicky,8.0,19 (4),0
4,5,"Proud Mary, de Tina Turner",Ruth Lorenzo,12,12.0,12,12,12,Adrián,24.0,51 (12),0
4,5,"Qué será, será (Whatever Will Be, Will Be), de Doris Day (El hombre que sabía demasiado)",Silvia Abril,11,4.0,9,10,11,Adrián,20.0,37 (9),0
4,5,"Heart of glass, de Deborah Harry (Blondie)",Ana Morgade,10,9.0,11,8,9,Edu,20.0,41 (11),0
4,5,"América, de Nino Bravo",Adrián Rodríguez,5,5.0,4,9,10,Ruth,18.0,35 (8),0
4,5,"Demasiado corazón, de Willy DeVille",Edu Soto,8,8.0,8,11,8,Adrián,18.0,38 (10),0
4,5,"La mordidita, de Ricky Martin",Pablo Puyol,9,10.0,10,5,5,Adrián,12.0,34 (7),0
4,5,"Remolino, de Pancho Céspedes",Falete,4,6.0,7,6,7,Ana,11.0,23 (4),0
4,5,"Baila morena, de Zucchero",El Sevilla,7,7.0,6,4,6,Silvia,11.0,27 (5),0
4,5,"Tómame o déjame, de Amaya Uranga (Mocedades)",Vicky Larraz,6,11.0,5,7,4,El Sevilla,10.0,29 (6),0
4,6,"Angelitos negros, de Antonio Machín",Edu Soto,12,12.0,10,9,12,Sevilla,24.0,49 (12),0
4,6,"Loca, de Malena Gracia (Sorpresa, Sorpresa)",Ana Morgade,9,10.0,12,12,10,Falete,21.0,46 (11),0
4,6,"Highway to Hell, de Brian Johnson (AC/DC)",El Sevilla,5,9.0,8,11,11,Ana,20.0,36 (9),0
4,6,"Es mi hombre, de Sara Montiel",Falete,11,11.0,11,10,9,Ruth,19.0,46 (10),0
4,6,"Cheerleader, de OMI",Adrián Rodríguez,10,8.0,7,7,7,Edu,15.0,32 (8),0
4,6,"Toda la noche en la calle, de Eva Amaral (Amaral)",Ruth Lorenzo,7,7.0,6,6,8,Silvia,14.0,29 (6),0
4,6,"Don't Go Breaking My Heart, de Elton John y RuPaul (Dos en uno)[18]​",Pablo Puyol,8,5.0,9,8,5,Silvia,12.0,30 (7),0
4,6,"Womanizer, de Britney Spears",Silvia Abril,4,4.0,4,4,6,Vicky,10.0,22 (4),0
4,6,"Voyage voyage, de Desireless",Vicky Larraz,6,6.0,5,5,4,Edu,9.0,25 (5),0
4,7,"Abuelito dime tú, de Heidi (Heidi)",Silvia Abril,9,12.0,7,10,12,Vicky,24.0,53 (12),0
4,7,"Personal Jesus, de Marilyn Manson",Ruth Lorenzo,10,9.0,11,11,11,Silvia,21.0,41 (10),0
4,7,"Propuesta indecente, de Romeo Santos",Adrián Rodríguez,12,10.0,12,8,10,Vicky,21.0,45 (11),0
4,7,"El jardín prohibido, de Sandro Giacobbe",Pablo Puyol,11,8.0,9,12,9,Silvia,18.0,40 (9),0
4,7,"Black Is Black, de Mike Kennedy (Los Bravos)",Edu Soto,8,11.0,10,7,8,Silvia,16.0,36 (8),0
4,7,"La gozadera, de Alexander Delgado Hernández (Gente de Zona) con Xuso Jones como Marc Anthony (Trae un amigo)",El Sevilla,7,6.0,5,9,6,Silvia,12.0,27 (6),0
4,7,"If I Could Turn Back Time, de Cher",Vicky Larraz,4,4.0,8,6,5,Adrián,12.0,31 (7),0
4,7,"Saturday Night , de Whigfield",Ana Morgade,5,5.0,6,4,7,Silvia,11.0,20 (4),0
4,7,"Lobo hombre en París, de Rafa Sánchez (La Unión)",Falete,6,7.0,4,5,4,Vicky,9.0,22 (5),0
4,8,"Uptown Funk, de Bruno Mars",Pablo Puyol,8,12.0,10,12,12,Ruth,24.0,48 (12),0
4,8,"All by Myself, de Céline Dion",Ruth Lorenzo,11,11.0,12,10,11,Pablo,22.0,47 (11),0
4,8,"Cero, de Dani Martín",Adrián Rodríguez,12,7.0,8,8,10,El Sevilla,18.0,41 (8),0
4,8,"Sway, de Michael Bublé",Edu Soto,9,10.0,11,11,8,Adrián,18.0,44 (10),0
4,8,"Hawaii-Bombay, de Ana Torroja (Mecano)",Silvia Abril,7,6.0,7,5,9,El Sevilla,16.0,25 (7),0
4,8,"Comando G, de Tino Fernández ""Ficha Roja"" (Parchís) (Comando G)",El Sevilla,10,9.0,9,9,5,Pablo,14.0,43 (9),0
4,8,"Salta, de Alejo Stivel (Tequila)",Ana Morgade,4,8.0,5,7,7,Falete,13.0,24 (6),0
4,8,"El mismo sol, de Jennifer Lopez y Álvaro Soler (Original y Copia)",Vicky Larraz[20]​,6,5.0,4,6,6,Edu,10.0,21 (4),0
4,8,"I Am What I Am, de Gloria Gaynor",Falete,5,4.0,6,4,4,Adrián,9.0,22 (5),0
4,9,"Noche de bodas, de Chavela Vargas",El Sevilla,12,12.0,12,12,12,Adrián,24.0,69 (12),0
4,9,"Back to black, de Amy Winehouse",Ruth Lorenzo,9,10.0,10,10,11,El Sevilla,21.0,39 (10),0
4,9,"Smooth criminal , de Michael Jackson",Edu Soto,10,11.0,11,11,10,El Sevilla,21.0,46 (11),0
4,9,"Livin' on a Prayer, de Jon Bon Jovi (Bon Jovi)",Pablo Puyol,11,8.0,9,9,9,El Sevilla,18.0,37 (9),0
4,9,"Supernatural, de Marta Sánchez (Olé Olé)",Ana Morgade,7,7.0,5,8,8,El Sevilla,15.0,27 (7),0
4,9,"You Can't Hurry Love, de Diana Ross & The Supremes",Vicky Larraz,8,9.0,8,5,7,El Sevilla,15.0,30 (8),0
4,9,"Humanos a Marte, de Chayanne",Adrián Rodríguez,6,6.0,6,6,6,Edu,12.0,27 (6),0
4,9,"El baúl de los recuerdos, de Karina",Silvia Abril,4,4.0,4,4,5,El Sevilla,9.0,16 (4),0
4,9,"La vie en rose, de Édith Piaf",Falete,5,5.0,7,7,4,El Sevilla,9.0,24 (5),0
4,10,"Why don't you do right?, de Jessica Rabbit (¿Quién engañó a Roger Rabbit?)",Ruth Lorenzo,11,9.0,10,11,11,Pablo,22.0,41 (11),0
4,10,"Tonight (I'm Lovin' You), de Enrique Iglesias",Adrián Rodríguez,12,12.0,12,12,10,Silvia,22.0,54 (12),0
4,10,"Caruso, de Andrea Bocelli",Pablo Puyol,9,7.0,8,9,12,Silvia,20.0,36 (8),0
4,10,"Hard Rock Hallelujah, de Tomi Putaansuu (Mr Lordi) (Lordi)",El Sevilla,10,11.0,9,8,9,Adrián,18.0,38 (9),0
4,10,"La vida es un carnaval, de Celia Cruz",Silvia Abril,4,4.0,11,6,8,Adrián,18.0,40 (10),0
4,10,"Francisco Alegre, de Isabel Pantoja",Falete,8,10.0,7,10,6,Edu,13.0,35 (7),0
4,10,"Vente pa' Madrid, de Antonio Carmona (Ketama)",Edu Soto,7,6.0,4,5,7,Silvia,12.0,25 (5),0
4,10,"Ven, devórame otra vez, de Toñi Salazar con Anna Simon como Encarna Salazar (Azúcar Moreno) (Trae un amigo)",Ana Morgade,6,8.0,6,7,5,Silvia,11.0,27 (6),0
4,10,"Gold, de Tony Hadley (Spandau Ballet)",Vicky Larraz,5,5.0,5,4,4,Silvia,8.0,19 (4),0
4,11,"Yo soy aquel, de Raphael",Edu Soto,11,9.0,11,8,12,Falete,22.0,39 (10),0
4,11,"Solamente tú, de Pablo Alborán",Adrián Rodríguez,12,11.0,10,12,11,Ana,22.0,51 (11),0
4,11,"Anaconda, de Nicki Minaj",Ana Morgade,10,12.0,12,11,10,Adrián,22.0,63 (12),0
4,11,"La mañana, de Al Bano",Falete,8,8.0,9,9,8,Ana,17.0,37 (9),0
4,11,"Want to Want Me, de Jason Derulo",Pablo Puyol,7,7.0,7,7,9,Ana,16.0,28 (7),0
4,11,"Un ramito de violetas, de Cecilia",Vicky Larraz,9,10.0,6,10,7,Ana,15.0,35 (8),0
4,11,"Tutti frutti, de Little Richard",El Sevilla,4,5.0,4,5,6,Ana,10.0,18 (4),0
4,11,"El beso, de Paquita Rico",Silvia Abril,5,4.0,5,6,5,Ana,10.0,20 (5),0
4,11,"Conga, de Gloria Estefan (Miami Sound Machine)",Ruth Lorenzo,6,6.0,8,4,4,Adrián,10.0,24 (6),0
4,12,"Bang Bang (My Baby Shot Me Down), de Nancy Sinatra",Ana Morgade,10,10.0,6,10,10,Vicky,20.0,39 (10),0
4,12,"Light my fire, de Jim Morrison (The Doors)",Edu Soto,11,11.0,7,11,9,Pablo,20.0,43 (11),0
4,12,"Soy lo prohibido, de Olga Guillot",Falete,12,12.0,11,12,8,Vicky,20.0,50 (12),0
4,12,"Rise Like a Phoenix, de Conchita Wurst",Ruth Lorenzo,8,8.0,9,9,12,Ana,19.0,34 (7),0
4,12,"Basket Case, de Billie Joe Armstrong (Green Day)",Adrián Rodríguez,9,9.0,8,6,11,Sevilla,19.0,35 (8),0
4,12,"Pastillas para dormir, de David Muñoz (Estopa) (Training VIP)",El Sevilla,7,6.0,10,5,7,Falete,13.0,31 (6),0
4,12,"Lips Are Movin, de Meghan Trainor",Vicky Larraz,6,7.0,12,8,4,Adrián,13.0,39 (9),0
4,12,"Eres, de Massiel",Silvia Abril,5,5.0,5,7,6,Pablo,11.0,22 (5),0
4,12,"Insurrección, de Manolo García (El Último de la Fila)",Pablo Puyol,4,4.0,4,4,5,Edu,9.0,22 (4),0
4,13,"Suspicious Minds, de Elvis Presley",Adrián Rodríguez,11,12.0,8,10,11,Vicky,22.0,50 (11),0
4,13,"La fiesta terminó, de Paloma San Basilio (Training VIP)",Vicky Larraz,12,10.0,10,12,9,Adrián,21.0,62 (12),0
4,13,"All of Me, de John Legend",Pablo Puyol,8,8.0,11,7,12,Vicky,20.0,34 (8),0
4,13,"Shake It Out, de Florence Welch (Florence & The Machine)",Ruth Lorenzo,10,11.0,9,11,10,Vicky,20.0,41 (10),0
4,13,"Tomasa, de Lolita Flores",Falete,7,9.0,12,6,8,Vicky,17.0,34 (9),0
4,13,"Nel blu dipinto di blu (Volare), de Domenico Modugno",Edu Soto,9,7.0,7,8,7,Adrián,14.0,31 (7),0
4,13,"Voy en un coche, de Christina Rosenvinge (Christina y Los Subterráneos)",Ana Morgade,4,4.0,5,9,6,Adrián,12.0,22 (6),0
4,13,"Pa' mi guerrera, de Huecco",El Sevilla,6,5.0,4,5,5,Vicky,9.0,20 (4),0
4,13,"It's Raining Men, de Geri Halliwell",Silvia Abril,5,6.0,6,4,4,Vicky,9.0,21 (5),0
4,14,"Heroes, de Måns Zelmerlöw",Pablo Puyol,11,12.0,11,11,12,Ana,23.0,51 (11),0
4,14,"The Lady Is a Tramp, de Lady Gaga con Andreu Buenafuente como Tony Bennet (Trae un amigo)",Silvia Abril,12,11.0,12,12,11,Sevilla,23.0,53 (12),0
4,14,"Los piconeros, de Penélope Cruz (La niña de tus ojos)",Ana Morgade,8,7.0,10,6,10,Silvia,20.0,40 (10),0
4,14,"All I Want for Christmas Is You, de Mariah Carey",Ruth Lorenzo,10,10.0,4,5,8,Ana,17.0,32 (9),0
4,14,"Clocks, de Chris Martin (Coldplay)",Edu Soto,9,5.0,7,10,9,Silvia,16.0,31 (7),0
4,14,"Me muero, de Natalia Jiménez (La 5ª Estación)",Falete,4,9.0,9,9,6,Ana,14.0,31 (8),0
4,14,"Otro día más sin verte, de Jon Secada",Adrián Rodríguez,7,8.0,8,7,7,Pablo,13.0,30 (6),0
4,14,"La gallina Cocoguagua, de Ana Anguita (Enrique y Ana) (Sorpresa, Sorpresa)",El Sevilla,5,6.0,6,4,5,Pablo,10.0,24 (5),0
4,14,"Physical,de Olivia Newton-John",Vicky Larraz,6,4.0,5,8,4,Ruth,8.0,23 (4),0
4,15,"Glitter in the Air, de P!nk",Ruth Lorenzo,11,11.0,12,12,11,,22,46 (11),0
4,15,"Por debajo de la mesa, de Luis Miguel",Pablo Puyol,8,8.0,10,9,10,,19,35 (9),0
4,15,"Just a Girl, de Gwen Stefani (No Doubt)",Ana Morgade,10,9.0,8,10,8,,18,37 (10),0
4,15,"Torbellino de colores, de Lola Flores",Falete,12,12.0,11,11,6,,18,46 (12),0
4,15,"Start Me Up, de Mick Jagger (The Rolling Stones)",Edu Soto,9,5.0,5,4,12,,17,23 (5),0
4,15,"Mamá, quiero ser artista, de Concha Velasco",Silvia Abril,6,10.0,7,8,9,,17,31 (8),0
4,15,"Can't Feel My Face, de The Weeknd",Adrián Rodríguez,7,6.0,6,5,7,,13,24 (6),0
4,15,"Feo, fuerte y formal, de Loquillo (Loquillo y Trogloditas)",El Sevilla,5,7.0,9,6,5,,12,27 (7),0
4,15,"It Must Have Been Love, de Marie Fredriksson (Roxette)",Vicky Larraz,4,4.0,4,7,4,,8,19 (4),0
4,16,"Unchained Melody, de Bobby Hatfield (The Righteous Brothers)",Edu Soto,10,12.0,12,10,12,,24,44 (12),0
4,16,"Don't Cry, de Axl Rose (Guns N' Roses)",Pablo Puyol,12,11.0,11,8,11,,21,42 (10),0
4,16,"Downtown, de Petula Clark",Ana Morgade,8,8.0,8,9,10,,19,33 (9),0
4,16,"'O sole mio, de Luciano Pavarotti",Falete,11,10.0,10,11,8,,19,42 (11),0
4,16,"Dramas y comedias, de Alaska (Fangoria)",Silvia Abril,7,6.0,7,12,9,,16,32 (7),0
4,16,"La nueva y la ex, de Daddy Yankee",Adrián Rodríguez,9,9.0,9,6,7,,15,33 (8),0
4,16,"Corazón de neón, de Javier Gurruchaga (Orquesta Mondragón)",El Sevilla,6,7.0,6,7,6,,12,26 (6),0
4,16,"Hello, de Adele",Vicky Larraz,5,5.0,5,5,5,,10,20 (5),0
5,1,"I'll Be There y Who's Lovin' You, de Michael Jackson (The Jackson 5)",Beatriz Luengo,10,11.0,12,12,12,,24.0,45 (12),0
5,1,"Next to Me, de Emeli Sandé",Rosa López,7,9.0,11,7,11,,19.0,34 (8),0
5,1,"Como yo te amo, de Raphael",Blas Cantó,8,7.0,10,10,10,,19.0,35 (9),0
5,1,"Tengo miedo, de Marifé de Triana",Lorena Gómez,11,10.0,9,11,9,,19.0,41 (10),0
5,1,"Unchain My Heart, de Joe Cocker",Juan Muñoz,12,12.0,8,9,8,,19.0,41 (11),0
5,1,"Limón y sal, de Julieta Venegas",Esther Arroyo,9,8.0,7,8,7,,14.0,32 (7),0
5,1,"Mediterráneo, de Carlos Segarra (Los Rebeldes)",Canco Rodríguez,6,6.0,6,6,6,,12.0,24 (6),0
5,1,"Picky, de Joey Montana",David Guapo,4,4.0,4,5,5,,9.0,17 (4),0
5,1,"El ritmo de la noche, de María Chica Sánchez (Mystic)",Yolanda Ramos,5,5.0,5,4,4,,9.0,24 (5),0
5,2,"Sax, de Fleur East",Lorena Gómez,12,12.0,12,11,12,,24.0,47 (12),0
5,2,"Venecia sin ti, de Dyango (Training VIP)",Juan Muñoz,11,11.0,11,12,11,,22.0,45 (11),0
5,2,"Greased Lightning , de John Travolta (Grease)",Blas Cantó,10,10.0,10,10,10,,20.0,40 (10),0
5,2,"La vie en rose, de Grace Jones",Esther Arroyo,8,8.0,8,8,9,,17.0,32 (8),0
5,2,"I'm a Slave 4 U, de Britney Spears",Beatriz Luengo,9,9.0,9,9,8,,17.0,36 (9),0
5,2,"Corazón contento, de Marisol",Rosa López,6,7.0,7,7,7,,14.0,27 (7),0
5,2,"Soy lo que me das, de Chenoa",Canco Rodríguez,7,6.0,6,6,6,,12.0,25 (6),0
5,2,"Hymn for the Weekend, de Chris Martin (Coldplay)",David Guapo,4,5.0,4,4,5,,9.0,17 (4),0
5,2,"Un pueblo es, María Ostiz",Yolanda Ramos,5,4.0,5,5,4,,9.0,19 (5),0
5,3,"Can't Stop the Feeling!, de Justin Timberlake",Blas Cantó,12,12.0,11,11,12,,24.0,46 (12),0
5,3,"La casa por el tejado, de Fito Cabrales (Fito y los Fitipaldis)",Juan Muñoz,10,10.0,8,9,11,,21.0,37 (10),0
5,3,"No, de Meghan Trainor",Rosa López,11,11.0,10,12,9,,20.0,44 (11),0
5,3,"Always , de Jon Bon Jovi (Bon Jovi)",Lorena Gómez,9,7.0,7,8,8,,17.0,31 (9),0
5,3,"Diles, de Malú",Beatriz Luengo,7,8.0,9,6,10,,16.0,30 (6),0
5,3,"Pippi Calzaslargas, de Pippi Långstrump (Pipi Calzaslargas)",Yolanda Ramos,4,4.0,12,10,7,,15.0,30 (8),0
5,3,"Don't get me wrong, de Chrissie Hynde (The Pretenders)",Esther Arroyo,8,9.0,6,7,6,,13.0,30 (7),0
5,3,"Juanita Banana, de Luis Aguilé",Canco Rodríguez,5,6.0,5,5,5,,10.0,21 (5),0
5,3,"Cómo te atreves, de Juan Pablo Isaza (Morat) (Original y copia)",David Guapo,6,5.0,4,4,4,,8.0,19 (4),0
5,4,"Sola, de Diana Navarro (Training VIP)",Blas Cantó,12,12.0,12,12,12,,24.0,48 (12),0
5,4,"GoldenEye, de Tina Turner",Rosa López,6,11.0,10,6,10,,20.0,33 (10),0
5,4,"Just a Gigolo y I Ain't Got Nobody, de Louis Prima",Juan Muñoz,11,10.0,11,8,9,,20.0,40 (11),0
5,4,"If I Ain't Got You , de Alicia Keys con Las Supremas de Móstoles como coristas",Beatriz Luengo,8,7.0,9,7,11,,19.0,31 (8),0
5,4,"La salchipapa, de Leticia Sabater",Yolanda Ramos,10,6.0,7,10,7,,16.0,33 (9),0
5,4,"La chica de ayer, de Antonio Vega (Nacha Pop)",Canco Rodríguez,5,9.0,5,11,8,,15.0,30 (7),0
5,4,"Ven sin temor, de Bruno Lomas con Las Supremas de Móstoles como coristas",David Guapo,7,8.0,6,9,6,,12.0,30 (6),0
5,4,"Domino , de Jessie J",Lorena Gómez,9,5.0,8,5,5,,10.0,27 (5),0
5,4,"Perfect, de Eddi Reader (Fairground Attraction)",Esther Arroyo,4,4.0,4,4,4,,8.0,16 (4),0
5,5,"90 minutos, de India Martínez (Training VIP)",Lorena Gómez,12,12.0,12,12,12,,24.0,48 (12),0
5,5,"Stay With Me, de Sam Smith",Blas Cantó,9,10.0,10,6,10,,20.0,35 (10),0
5,5,"All That Jazz, de Catherine Zeta-Jones (Chicago)",Beatriz Luengo,11,11.0,11,9,9,,20.0,42 (11),0
5,5,"Frozen, de Madonna",Rosa López,5,5.0,7,8,11,,17.0,25 (6),0
5,5,"Pon una cinta en el viejo roble, de Helena Bianco (Los Mismos)",Esther Arroyo,8,8.0,9,10,8,,17.0,35 (9),0
5,5,"Adiós, papá, de Coque Malla (Los Ronaldos)",David Guapo,10,9.0,8,7,7,,15.0,34 (8),0
5,5,"Hola, mi amor, de Junco",Yolanda Ramos,7,6.0,5,11,4,,11.0,29 (7),0
5,5,"It's A Heartache, de Bonnie Tyler",Juan Muñoz,6,4.0,4,4,6,,10.0,18 (4),0
5,5,"Come As You Are, de Kurt Cobain (Nirvana)",Canco Rodríguez,4,7.0,6,5,5,,10.0,22 (5),0
5,6,"Friday I'm in Love, de Robert Smith (The Cure)",Canco Rodríguez,12,12.0,12,12,10,,22.0,48 (12),0
5,6,"Livin' la vida loca, de Ricky Martin",Blas Cantó,9,10.0,10,9,12,,22.0,38 (10),0
5,6,"Marinero de luces, de Isabel Pantoja",Beatriz Luengo,8,9.0,9,11,11,,20.0,37 (9),0
5,6,"Amor a la mexicana, de Thalía",Rosa López,11,11.0,11,10,9,,20.0,43 (11),0
5,6,"La bicicleta, de Shakira con Xuso Jones como Carlos Vives (Trae un amigo)",Lorena Gómez,10,8.0,7,6,8,,16.0,31 (8),0
5,6,"Angie, de Mick Jagger (The Rolling Stones)",Esther Arroyo,6,6.0,6,8,7,,14.0,26 (7),0
5,6,"Big Spender, de Norma Duval",Yolanda Ramos,5,7.0,8,5,6,,12.0,25 (6),0
5,6,"Walk of Life, de Mark Knopfler (Dire Straits)",David Guapo,7,5.0,5,7,5,,10.0,24 (5),0
5,6,"El muerto vivo, de Peret",Juan Muñoz,4,4.0,4,4,4,,8.0,16 (4),0
5,7,"Crazy, de Patsy Cline",Esther Arroyo,9,11.0,10,11,12,,23.0,41 (11),0
5,7,"Qué voy a hacer con mi amor, de Alejandro Fernández",Blas Cantó,11,9.0,11,10,11,,21.0,41 (10),0
5,7,"Cheap Thrills, de Sia",Beatriz Luengo,12,12.0,12,12,9,,21.0,48 (12),0
5,7,"El progreso, de Roberto Carlos",Juan Muñoz,10,10.0,9,9,10,,19.0,38 (9),0
5,7,"When We Were Young, de Adele",Lorena Gómez,7,7.0,7,6,8,,14.0,27 (6),0
5,7,"Trololo, de  Eduard Khill",Canco Rodríguez,8,8.0,5,7,7,,14.0,28 (7),0
5,7,"Maman, maman, de Jean Jacques",Yolanda Ramos,6,6.0,8,8,5,,13.0,28 (8),0
5,7,"Dancing Queen, de Anni-Frid Lyngstad con Verónica Romero como Agnetha Fältskog (ABBA) (Trae un amigo)",Rosa López,5,4.0,6,4,6,,11.0,19 (5),0
5,7,"Duro de pelar, de Rebeca",David Guapo,4,5.0,4,5,4,,8.0,18 (4),0
5,8,"Believe, de Cher",Blas Cantó,12,11.0,10,12,12,,24.0,45 (12),0
5,8,"Bad Girls, de Donna Summer con Las Supremas de Móstoles como coristas",Rosa López,8,8.0,8,8,11,,19.0,32 (8),0
5,8,"Fue un placer conocerte, de Rocío Dúrcal",Lorena Gómez,11,10.0,11,11,9,,19.0,43 (10),0
5,8,"Memory, de Barbra Streisand",Beatriz Luengo,9,7.0,7,6,10,,17.0,29 (7),0
5,8,"Poupée de cire, poupée de son, de France Gall",Esther Arroyo,7,9.0,9,9,7,,16.0,34 (9),0
5,8,"Pa Madrid, de El Barrio",Juan Muñoz,10,12.0,12,10,4,,15.0,44 (11),0
5,8,"Duele el corazón, de Enrique Iglesias",David Guapo,5,5.0,6,5,8,,13.0,21 (5),0
5,8,"Madre Tierra, de Chayanne",Canco Rodríguez,6,6.0,5,7,5,,11.0,24 (6),0
5,8,"Piece of my heart, de Janis Joplin con Las Supremas de Móstoles como coristas",Yolanda Ramos,4,4.0,4,4,6,,10.0,16 (4),0
5,9,"Devuélveme la vida, de Antonio Orozco",Canco Rodríguez,12,10.0,10,12,12,,24.0,44 (12),0
5,9,"Feeling Good, de Michael Bublé",Blas Cantó,10,11.0,9,11,11,,22.0,41 (11),0
5,9,"New York, New York, de Liza Minnelli con Pablo Puyol como Frank Sinatra (Trae un amigo)",Beatriz Luengo,9,12.0,8,10,10,,19.0,39 (9),0
5,9,"Me duele la cara de ser tan guapo, de Alfonso Aguado (Los Inhumanos)",David Guapo,11,8.0,12,8,8,,18.0,39 (10),0
5,9,"Te quiero, te quiero, de Carmen Sevilla",Rosa López,7,9.0,11,9,9,,17.0,36 (8),0
5,9,"Stronger (What Doesn't Kill You), de Kelly Clarkson",Lorena Gómez,8,7.0,7,7,6,,13.0,29 (7),0
5,9,"Smooth Operator, de Sade Adu (Sade)",Esther Arroyo,6,5.0,5,6,7,,12.0,22 (5),0
5,9,"In the summertime, de Ray Dorset (Mungo Jerry)",Juan Muñoz,5,6.0,6,5,5,,11.0,22 (6),0
5,9,"Fever, de Peggy Lee",Yolanda Ramos,4,4.0,4,4,4,,8.0,16 (4),0
5,10,"S.O.S, de Falete (Training VIP)",Blas Cantó,12,12.0,12,12,12,,24.0,48 (12),0
5,10,"Cuando nadie me ve, de Niña Pastori",Lorena Gómez,10,11.0,10,11,11,,21.0,42 (10),0
